{
  "project_id": "001-voynich-manuscript",
  "style_token": "FactForge archival mystery-documentary style, painterly semi-realistic illustration, aged vellum and parchment texture, muted sepia and deep teal duotone palette, warm candlelight accents, cinematic high-contrast lighting, restrained painterly detail, no modern elements, museum-archive atmosphere",
  "scenes": [
    {
      "scene_id": "scene_001",
      "image_filename": "scene_001.png",
      "main_prompt": "FactForge archival mystery-documentary style, painterly semi-realistic illustration, aged vellum and parchment texture, muted sepia and deep teal duotone palette, warm candlelight accents, cinematic high-contrast lighting, restrained painterly detail, no modern elements, museum-archive atmosphere. A dim, climate-controlled rare-book vault interior in muted Deep Archive Teal lighting; a locked glass display case holds an ancient bound manuscript with a worn leather-and-vellum cover; faint ghostly overlay in the shadowed background of looping indecipherable script and the silhouette of a vintage WWII-era cipher machine; a single warm Candlelight Amber spotlight falls on the manuscript case; tight, centered composition suggesting a slow push-in; hushed, reverent, mysterious mood",
      "negative_prompt": "photorealistic human faces, modern clothing, modern technology or logos, neon colors, pure white, pure black, flat vector icons, sans-serif text baked into image, dashboard chart aesthetic, handheld shaky camera look, blurry, oversaturated colors, cartoonish, anime style, 3D render, plastic look, watermark, extra limbs, disfigured hands, crowd of people",
      "camera_angle": "Slow push-in, eye-level, centered on the locked glass case",
      "lighting": "Single warm Candlelight Amber key light on the manuscript case, Deep Archive Teal ambient fill, vignette fading to Shadow Charcoal at the frame edges",
      "composition": "Centered subject in sharp focus, vault background softly blurred, generous negative space in the upper third for a title card",
      "alt_prompts": [
        "Same vault and lighting, wider establishing framing that reveals more of the vault's shelving and architecture around the central case, still centered on the manuscript",
        "Same composition but with the Enigma-machine silhouette rendered more clearly in the background shadow, slightly more prominent than the base version"
      ],
      "leonardo_settings": { "model": "Leonardo Phoenix 1.0", "aspect_ratio": "16:9", "guidance_scale": 7, "seed": null, "style_reference": null },
      "status": "pending"
    },
    {
      "scene_id": "scene_002",
      "image_filename": "scene_002.png",
      "main_prompt": "FactForge archival mystery-documentary style, painterly semi-realistic illustration, aged vellum and parchment texture, muted sepia and deep teal duotone palette, warm candlelight accents, cinematic high-contrast lighting, restrained painterly detail, no modern elements, museum-archive atmosphere. Extreme macro close-up of an open manuscript page: dense, flowing, elegant handwriting in an unknown alphabet fills the aged parchment surface; visible ink-stroke texture and vellum grain; a gloved archivist's hand enters frame from the right, gently turning the page; shallow depth of field with the page in crisp focus and the room falling into soft Umber-toned blur behind it",
      "negative_prompt": "photorealistic human faces, modern clothing, modern technology or logos, neon colors, pure white, pure black, flat vector icons, sans-serif text baked into image, dashboard chart aesthetic, handheld shaky camera look, blurry text, oversaturated colors, cartoonish, anime style, 3D render, plastic look, watermark, legible real-world language text, extra fingers, disfigured hand",
      "camera_angle": "Macro close-up, slight top-down angle looking directly down at the page",
      "lighting": "Soft, even Candlelight Amber wash across the page with gentle Umber shadow pooling at the page's curled edge",
      "composition": "Page fills the frame edge to edge, hand and turning page corner positioned in the lower right third",
      "alt_prompts": [
        "Same macro framing but camera gliding laterally across a full two-page spread instead of a single page turn, no hand visible",
        "Tighter crop focusing only on a cluster of the unknown script glyphs, no hand, emphasizing ink texture"
      ],
      "leonardo_settings": { "model": "Leonardo Phoenix 1.0", "aspect_ratio": "16:9", "guidance_scale": 7, "seed": null, "style_reference": "scene_001.png" },
      "status": "pending"
    },
    {
      "scene_id": "scene_003",
      "image_filename": "scene_003.png",
      "main_prompt": "FactForge archival mystery-documentary style, painterly semi-realistic illustration, aged vellum and parchment texture, muted sepia and deep teal duotone palette, warm candlelight accents, cinematic high-contrast lighting, restrained painterly detail, no modern elements, museum-archive atmosphere. A manuscript herbal-section page illustration: a strange botanical drawing combining unfamiliar leaf shapes, an oversized root system, and a stem that matches no real plant, rendered in the manuscript's own aged ink-and-wash illustration style; a slow lateral pan implied across a spread of similar impossible plant pages in the background, softly out of focus",
      "negative_prompt": "photorealistic photography, modern clothing, modern technology or logos, neon colors, pure white, pure black, flat vector icons, sans-serif text, dashboard chart aesthetic, oversaturated colors, cartoonish, anime style, 3D render, plastic look, watermark, recognizable real-world plant species, bright natural green",
      "camera_angle": "Slow horizontal pan across a page spread, medium-close framing on the foreground plant illustration",
      "lighting": "Even Candlelight Amber page-light with Deep Archive Teal shadow in the page margins",
      "composition": "Foreground plant illustration large and centered, additional plant pages softly blurred in the background for depth",
      "alt_prompts": [
        "Same style but framed as a full-page single illustration with no background pages visible, more emphasis on the root structure detail"
      ],
      "leonardo_settings": { "model": "Leonardo Phoenix 1.0", "aspect_ratio": "16:9", "guidance_scale": 7, "seed": null, "style_reference": "scene_001.png" },
      "status": "pending"
    },
    {
      "scene_id": "scene_004",
      "image_filename": "scene_004.png",
      "main_prompt": "FactForge archival mystery-documentary style, painterly semi-realistic illustration, aged vellum and parchment texture, muted sepia and deep teal duotone palette, warm candlelight accents, cinematic high-contrast lighting, restrained painterly detail, no modern elements, museum-archive atmosphere. A circular astronomical diagram from the manuscript's astronomical section: concentric rings with suns, moons, and stars, and a zodiac symbol (a bull for Taurus) rendered in period illustration linework, aged ink on parchment, centered in frame like a rotating star chart",
      "negative_prompt": "photorealistic photography, modern clothing, modern technology or logos, neon colors, pure white, pure black, flat vector icons, sans-serif text, dashboard chart aesthetic, oversaturated colors, cartoonish, anime style, 3D render, plastic look, watermark, real astronomical photography, modern star-map UI",
      "camera_angle": "Static centered shot with implied gentle rotation of the circular diagram",
      "lighting": "Warm Candlelight Amber glow radiating from the diagram's center, fading to Deep Archive Teal at the page corners",
      "composition": "Circular diagram fills most of the frame, perfectly centered, aged parchment margin visible at the edges",
      "alt_prompts": [
        "Same diagram style but featuring a hunter-with-crossbow zodiac symbol (Sagittarius) instead of the bull, same layout"
      ],
      "leonardo_settings": { "model": "Leonardo Phoenix 1.0", "aspect_ratio": "16:9", "guidance_scale": 7, "seed": null, "style_reference": "scene_001.png" },
      "status": "pending"
    },
    {
      "scene_id": "scene_005",
      "image_filename": "scene_005.png",
      "main_prompt": "FactForge archival mystery-documentary style, painterly semi-realistic illustration, aged vellum and parchment texture, muted sepia and deep teal duotone palette, warm candlelight accents, cinematic high-contrast lighting, restrained painterly detail, no modern elements, museum-archive atmosphere. A stylized reproduction of the manuscript's biological-section illustration: small, simplified illustrated figures within interconnected tube-and-vessel structures, immersed in pools of muted teal-green liquid, rendered in the manuscript's own restrained archival illustration style, non-literal and tasteful, treated strictly as historical artifact reproduction",
      "negative_prompt": "photorealistic human bodies, nudity rendered realistically, modern clothing, modern technology or logos, neon colors, pure white, pure black, flat vector icons, sans-serif text, dashboard chart aesthetic, oversaturated colors, cartoonish, anime style, 3D render, plastic look, watermark, sexualized content, bright natural green",
      "camera_angle": "Medium close-up, static frame on the tube-and-vessel diagram cluster",
      "lighting": "Cool Deep Archive Teal glow from within the liquid pools, thin warm Candlelight Amber rim light along the vessel edges",
      "composition": "Diagram cluster centered, symmetrical layout echoing the manuscript's own page composition, aged parchment border visible",
      "alt_prompts": [
        "Same subject but framed as a wider page view showing the full network of tubes and multiple pools rather than a single cluster"
      ],